{
  "policy_id": "sf-daily-market-dashboard-v1",
  "dataset_id": "ram",
  "market": "GB",
  "currency": "GBP",
  "time_zone": "Europe/London",
  "first_date": "2023-01-31",
  "latest_date": "2026-08-17",
  "declared_products": [
    {
      "mpn": "CMK32GX5M2B6000C36",
      "manufacturer": "Corsair",
      "model": "Corsair VENGEANCE DDR5-6000 CL36 Black",
      "memory_type": "DDR5",
      "capacity_gb": 32,
      "module_count": 2,
      "speed_mt_s": 6000,
      "form_factor": "UDIMM"
    },
    {
      "mpn": "KF560C30BBEK2-32",
      "manufacturer": "Kingston Technology",
      "model": "Kingston FURY Beast DDR5 6000 CL30",
      "memory_type": "DDR5",
      "capacity_gb": 32,
      "module_count": 2,
      "speed_mt_s": 6000,
      "form_factor": "UDIMM"
    },
    {
      "mpn": "KF564C32RSK2-32",
      "manufacturer": "Kingston Technology",
      "model": "Kingston FURY Renegade DDR5 6400 CL32",
      "memory_type": "DDR5",
      "capacity_gb": 32,
      "module_count": 2,
      "speed_mt_s": 6400,
      "form_factor": "UDIMM"
    }
  ],
  "points": [
    {
      "date": "2023-01-31",
      "typical_minor": 15060,
      "low_minor": 15060,
      "high_minor": 15060,
      "product_count": 1,
      "declared_product_count": 3,
      "retailer_count": 1,
      "observation_count": 1,
      "coverage_permille": 333,
      "capture_basis": "archive",
      "products": [
        {
          "mpn": "KF564C32RSK2-32",
          "median_minor": 15060,
          "low_minor": 15060,
          "high_minor": 15060,
          "retailer_count": 1
        }
      ],
      "low_evidence": [
        {
          "public_observation_id": "offer-97f0e6f3e53c48e2dbcdb026",
          "observed_at": "2023-01-31T16:46:06Z",
          "observation_kind": "archived_retail_observation",
          "mpn": "KF564C32RSK2-32",
          "retailer_id": "ccl",
          "retailer_name": "CCL",
          "item_price_minor": 15060,
          "source_url": "https://web.archive.org/web/20230131164606id_/https://www.cclonline.com/kf564c32rsk2-32-kingston-fury-renegade-32gb-2x16gb-6400mhz-ddr5-memory-kit-390326/"
        }
      ],
      "high_evidence": [
        {
          "public_observation_id": "offer-97f0e6f3e53c48e2dbcdb026",
          "observed_at": "2023-01-31T16:46:06Z",
          "observation_kind": "archived_retail_observation",
          "mpn": "KF564C32RSK2-32",
          "retailer_id": "ccl",
          "retailer_name": "CCL",
          "item_price_minor": 15060,
          "source_url": "https://web.archive.org/web/20230131164606id_/https://www.cclonline.com/kf564c32rsk2-32-kingston-fury-renegade-32gb-2x16gb-6400mhz-ddr5-memory-kit-390326/"
        }
      ]
    },
    {
      "date": "2023-09-26",
      "typical_minor": 15060,
      "low_minor": 15060,
      "high_minor": 15060,
      "product_count": 1,
      "declared_product_count": 3,
      "retailer_count": 1,
      "observation_count": 1,
      "coverage_permille": 333,
      "capture_basis": "archive",
      "products": [
        {
          "mpn": "KF564C32RSK2-32",
          "median_minor": 15060,
          "low_minor": 15060,
          "high_minor": 15060,
          "retailer_count": 1
        }
      ],
      "low_evidence": [
        {
          "public_observation_id": "offer-eb8305f6a8d9baefed916089",
          "observed_at": "2023-09-26T09:31:57Z",
          "observation_kind": "archived_retail_observation",
          "mpn": "KF564C32RSK2-32",
          "retailer_id": "ccl",
          "retailer_name": "CCL",
          "item_price_minor": 15060,
          "source_url": "https://web.archive.org/web/20230926093157id_/https://www.cclonline.com/kf564c32rsk2-32-kingston-fury-renegade-32gb-2x16gb-6400mhz-ddr5-memory-kit-390326/"
        }
      ],
      "high_evidence": [
        {
          "public_observation_id": "offer-eb8305f6a8d9baefed916089",
          "observed_at": "2023-09-26T09:31:57Z",
          "observation_kind": "archived_retail_observation",
          "mpn": "KF564C32RSK2-32",
          "retailer_id": "ccl",
          "retailer_name": "CCL",
          "item_price_minor": 15060,
          "source_url": "https://web.archive.org/web/20230926093157id_/https://www.cclonline.com/kf564c32rsk2-32-kingston-fury-renegade-32gb-2x16gb-6400mhz-ddr5-memory-kit-390326/"
        }
      ]
    },
    {
      "date": "2024-01-15",
      "typical_minor": 10699,
      "low_minor": 10699,
      "high_minor": 10699,
      "product_count": 1,
      "declared_product_count": 3,
      "retailer_count": 1,
      "observation_count": 1,
      "coverage_permille": 333,
      "capture_basis": "archive",
      "products": [
        {
          "mpn": "CMK32GX5M2B6000C36",
          "median_minor": 10699,
          "low_minor": 10699,
          "high_minor": 10699,
          "retailer_count": 1
        }
      ],
      "low_evidence": [
        {
          "public_observation_id": "offer-664e6ba24c1d07efb412d134",
          "observed_at": "2024-01-15T03:31:38Z",
          "observation_kind": "archived_retail_observation",
          "mpn": "CMK32GX5M2B6000C36",
          "retailer_id": "scan-computers",
          "retailer_name": "Scan Computers",
          "item_price_minor": 10699,
          "source_url": "https://web.archive.org/web/20240115033138id_/https://www.scan.co.uk/products/32gb-2x16gb-corsair-ddr5-vengeance-black-pc5-48000-6000-non-ecc-unbuffered-cas-36-xmp-30-125v"
        }
      ],
      "high_evidence": [
        {
          "public_observation_id": "offer-664e6ba24c1d07efb412d134",
          "observed_at": "2024-01-15T03:31:38Z",
          "observation_kind": "archived_retail_observation",
          "mpn": "CMK32GX5M2B6000C36",
          "retailer_id": "scan-computers",
          "retailer_name": "Scan Computers",
          "item_price_minor": 10699,
          "source_url": "https://web.archive.org/web/20240115033138id_/https://www.scan.co.uk/products/32gb-2x16gb-corsair-ddr5-vengeance-black-pc5-48000-6000-non-ecc-unbuffered-cas-36-xmp-30-125v"
        }
      ]
    },
    {
      "date": "2024-02-27",
      "typical_minor": 10898,
      "low_minor": 10898,
      "high_minor": 10898,
      "product_count": 1,
      "declared_product_count": 3,
      "retailer_count": 1,
      "observation_count": 1,
      "coverage_permille": 333,
      "capture_basis": "archive",
      "products": [
        {
          "mpn": "CMK32GX5M2B6000C36",
          "median_minor": 10898,
          "low_minor": 10898,
          "high_minor": 10898,
          "retailer_count": 1
        }
      ],
      "low_evidence": [
        {
          "public_observation_id": "offer-0b6e4793454819c61b62791f",
          "observed_at": "2024-02-27T03:36:29Z",
          "observation_kind": "archived_retail_observation",
          "mpn": "CMK32GX5M2B6000C36",
          "retailer_id": "scan-computers",
          "retailer_name": "Scan Computers",
          "item_price_minor": 10898,
          "source_url": "https://web.archive.org/web/20240227033629id_/https://www.scan.co.uk/products/32gb-2x16gb-corsair-ddr5-vengeance-black-pc5-48000-6000-non-ecc-unbuffered-cas-36-xmp-30-125v"
        }
      ],
      "high_evidence": [
        {
          "public_observation_id": "offer-0b6e4793454819c61b62791f",
          "observed_at": "2024-02-27T03:36:29Z",
          "observation_kind": "archived_retail_observation",
          "mpn": "CMK32GX5M2B6000C36",
          "retailer_id": "scan-computers",
          "retailer_name": "Scan Computers",
          "item_price_minor": 10898,
          "source_url": "https://web.archive.org/web/20240227033629id_/https://www.scan.co.uk/products/32gb-2x16gb-corsair-ddr5-vengeance-black-pc5-48000-6000-non-ecc-unbuffered-cas-36-xmp-30-125v"
        }
      ]
    },
    {
      "date": "2024-04-22",
      "typical_minor": 14999,
      "low_minor": 14999,
      "high_minor": 14999,
      "product_count": 1,
      "declared_product_count": 3,
      "retailer_count": 1,
      "observation_count": 1,
      "coverage_permille": 333,
      "capture_basis": "archive",
      "products": [
        {
          "mpn": "KF564C32RSK2-32",
          "median_minor": 14999,
          "low_minor": 14999,
          "high_minor": 14999,
          "retailer_count": 1
        }
      ],
      "low_evidence": [
        {
          "public_observation_id": "offer-5ce80720ea3345d48644966a",
          "observed_at": "2024-04-22T22:41:01Z",
          "observation_kind": "archived_retail_observation",
          "mpn": "KF564C32RSK2-32",
          "retailer_id": "overclockers-uk",
          "retailer_name": "Overclockers UK",
          "item_price_minor": 14999,
          "source_url": "https://web.archive.org/web/20240422224101id_/https://www.overclockers.co.uk/kingston-fury-renegade-32gb-2x16gb-ddr5-pc5-51200c32-6400mhz-dual-channel-my-29n-ks.html"
        }
      ],
      "high_evidence": [
        {
          "public_observation_id": "offer-5ce80720ea3345d48644966a",
          "observed_at": "2024-04-22T22:41:01Z",
          "observation_kind": "archived_retail_observation",
          "mpn": "KF564C32RSK2-32",
          "retailer_id": "overclockers-uk",
          "retailer_name": "Overclockers UK",
          "item_price_minor": 14999,
          "source_url": "https://web.archive.org/web/20240422224101id_/https://www.overclockers.co.uk/kingston-fury-renegade-32gb-2x16gb-ddr5-pc5-51200c32-6400mhz-dual-channel-my-29n-ks.html"
        }
      ]
    },
    {
      "date": "2024-09-09",
      "typical_minor": 11399,
      "low_minor": 11399,
      "high_minor": 11399,
      "product_count": 1,
      "declared_product_count": 3,
      "retailer_count": 1,
      "observation_count": 1,
      "coverage_permille": 333,
      "capture_basis": "archive",
      "products": [
        {
          "mpn": "CMK32GX5M2B6000C36",
          "median_minor": 11399,
          "low_minor": 11399,
          "high_minor": 11399,
          "retailer_count": 1
        }
      ],
      "low_evidence": [
        {